"paper_id","label","title","author","journal","volume","number","pages","year","doi","abstract","search_duplicated","n_duplicates","screened_final","notes_final"
"GNM_158","X.WOS.000175709400016","Short- and long-term effects of male-like concentrations of testosterone on female European starlings (Sturnus vulgaris)","De Ridder, E and Pinxten, R and Mees, V and Eens, M","AUK","119","2","487-497",2002,"10.1642/0004-8038(2002)119{[}0487:SALTEO]2.0.CO;2","European Starlings (Sturnus vulgaris) exhibit marked sex differences in behavior during spring. Song activity, nest-box occupation, the carrying of green nesting materials into a nest hole (typical mate-attraction behaviors), and aggression occur much more frequently in males who also have higher testosterone (T)-levels than females. Here, we examined whether male-like concentrations of T would activate these behaviors in female Starlings. We treated females with implants that were either empty (C-females) or packed with T (T-females) during late December. Although elevated T-levels significantly increased song activity in females, the proportion of time spent singing was still much lower than in males. T-treatment in females also failed to induce singing behavior in the nest box, a typical male mate-attraction behavior. Those results suggest both activational and organizational effects of T on singing. Nest-box occupation, carrying of green nesting material into a nest hole, and aggressive behavior were not activated by elevated T-levels, indicating that sex differences in these behaviors are probably based on early organizational effects of steroid hormones. We also evaluated effects of increased T-concentrations on some physiological, morphological, and immunological parameters. T-treatment strongly suppressed tail feather regrowth after experimental plucking, and also delayed onset of molt of wing feathers and slowed its progress. T-implantation caused color of the bill to change from black to yellow, but did not affect body mass. Immune function was determined by using two indirect measures: blood composition (haematocrit and buffy coat values) and indications of infections. Although haematocrit and buffy coat values did not differ between C- and T-females, T-females were significantly more infected with Staphylococcus aureus than C-females at the end of the experiment. Received 24 January 2001, accepted 14 January 2002.",158,2,"selected",NA
"GNM_160","Hays20014093","The diving behaviour of green turtles undertaking oceanic migration to and from Ascension Island: Dive durations, dive profiles and depth distribution","Hays, G.C. and √É‚Ä¶kesson, S. and Broderick, A.C. and Glen, F. and Godley, B.J. and Luschi, P. and Martin, C. and Metcalfe, J.D. and Papi, F.","Journal of Experimental Biology","204","23","4093-4098",2001,NA,"Satellite telemetry was used to record the submergence duration of green turtles (Chelonia mydas) as they migrated from Ascension Island to Brazil (N=12 individuals) while time/depth recorders (TDRs) were used to examine the depth distribution and dive profiles of individuals returning to Ascension Island to nest after experimental displacement (N=5 individuals). Satellite telemetry revealed that most submergences were short (<5min) but that some submergences were longer (>20min), particularly at night. TDRs revealed that much of the time was spent conducting short (2-4 min), shallow (approximately 0.9-1.5m) dives, consistent with predictions for optimisation of near-surface travelling, while long (typically 20-30 min), deep (typically 10-20 m) dives had a distinctive profile found in other marine reptiles. These results suggest that green turtles crossing the Atlantic do not behave invariantly, but instead alternate between periods of travelling just beneath the surface and diving deeper. These deep dives may have evolved to reduce silhouetting against the surface, which would make turtles more susceptible to visual predators such as large sharks.",160,2,"excluded","Not birds"
"GNM_162","X.WOS.000170209200002","A mammalian predator-prey imbalance: Grizzly bear and wolf extinction affect avian neotropical migrants","Berger, J and Stacey, PB and Bellis, L and Johnson, MP","ECOLOGICAL APPLICATIONS","11","4","947-960",2001,"10.1890/1051-0761(2001)011{[}0947:AMPPIG]2.0.CO;2","Because most large, terrestrial mammalian predators have already been lost from more than 95-99\% of the contiguous United States and Mexico, many ecological communities are either missing dominant selective forces or have new ones dependent upon humans. Such large-scale manipulations of a key element of most ecosystems offer unique opportunities to investigate how the loss of large carnivores affects communities, including the extent, if any, of interactions at different trophic levels. Here, we demonstrate a cascade of ecological events that were triggered by the local extinction of grizzly bears (Ursus arctos) and wolves (Canis lupus) from the southern Greater Yellowstone Ecosystem. These include (1) the demographic eruption of a large, semi-obligate, riparian-dependent herbivore, the moose (Alces alces), during the past 150 yr; (2) the subsequent alteration of riparian vegetation structure and density by ungulate herbivory; and (3) the coincident reduction of avian neotropical migrants in the impacted willow communities. We contrasted three sites matched hydrologically and ecologically in Grand Teton National Park, Wyoming, USA, where grizzly bears and wolves had been eliminated 60-75 yr ago and moose densities were about five times higher, with those on national forest lands outside the park, where predation by the two large carnivores has been replaced by human hunting and moose densities were lower. Avian species richness and nesting density varied inversely with moose abundance, and two riparian specialists, Gray Catbirds (Dumetella carolinensis) and MacGillivray's Warblers (Oporornis tolmiei), were absent from Park riparian systems where moose densities were high. Our findings not only offer empirical support for the top-down effect of large carnivores in terrestrial communities, but also provide a scientific rationale for restoration options to conserve biological diversity. To predict future impacts, whether overt or subtle, of past management, and to restore biodiversity, more must be known about ecological interactions, including the role of large carnivores. Restoration options with respect to the system that we studied in the southern Greater Yellowstone Ecosystem are simple: (1) do nothing and accept the erosion of biological diversity, (2) replace natural carnivores with human predation, or (3) allow continued dispersal of grizzly bears and wolves into previously occupied, but now vacant, habitat. Although additional science is required to further our understanding of this and other terrestrial systems, a larger conservation challenge remains: to develop public support for ecologically rational conservation options.",162,2,"excluded","Not empirical"
"GNM_164","X.WOS.000167035100001","Bioenergetics and nutrition of Mississippi Valley population Canada geese during winter and migration","Gates, RJ and Caithamer, DF and Moritz, WE and Tacha, TC","WILDLIFE MONOGRAPHS",NA,"146","1-65",2001,NA,"Survival and reproduction of northern-nesting geese are potentially affected by body condition during the non-breeding season. Body condition is presumed to be determined by the quantity of food available to geese during autumn, winter, and spring migration. However, food resources likely do not limit populations that exploit agricultural systems. Other factors such as hunting, refuge management, diet quality, weather may affect survival and reproduction. We studied time-energy budgets, food intake, and body condition to determine how Canada geese (Branta canadensis interior) of the Mississippi Valley Population (MVP) acquire and utilize energy and nutrients during autumn, winter, and spring migration during 1984-1989. Abundant food and behavioral flexibility allowed MVP Canada geese to exist on a high nutritional plane. Food intake was sufficient to meet or exceed daily energy and protein requirements except during winter. High energy, low protein diets fueled deposition of large lipid reserves, and were adequate to meet protein requirements during autumn in east-central Wisconsin. Late migrant geese that spent autumn in east-central Wisconsin expended more energy (x = 583 kcal/day) yet deposited more lipid (x = 4.51 g) compared to early migrants that spent autumn in southern Illinois (x = 526 kcal/day, x = 151 g lipid) during 1984 and 1985. Both groups averaged 4.5 hr feeding/day during autumn and consumed similar quantities (dry mass) of food (x = 187-190 g/day). However, late migrants consumed a high energy (x = 3.67 kcal/g) low protein (x = 12\%) diet comprised mostly of corn (x = 81\%) during autumn in east-central Wisconsin. Early migrants consumed a lower energy (x = 2.99 kcal/g) but higher protein (24\%) diet that consisted mostly of green forages (x = 24\% dry mass) in soybeans (x = 28\%) in southern Illinois. Wintering geese consumed a high energy (x = 3.49 kcal/g) diet with intermediate protein content (x = 19\%). Corn (x = 58\%) and soybeans (x = 22\%) comprised most of dry matter intake during winter in southern Illinois when daily energy expenditure averaged 536 kcal/day. However food intake declined (x = 152 g food/ day) during winter when geese averaged 3.5 hr feeding/day. Variation in crop food energy relative to population energy requirements on 2 southern Illinois refuges did not impact body condition during 1984-1989. Nutrient reserves contributed minimally (<1-6\%) to meeting daily energy requirements, so geese left winter refuges with more lipid and similar protein masses compared to early autumn. Geese exhibited a wide range of behavioral adaptation to spatial and temporal variation in food resources and nutritional requirements. Late migrants entered winter with larger energy reserves than early migrants during 1984-1989. Although early and late migrants were sympatric in southern Illinois during winter, they converged to similar levels of body condition by the end of winter during 1986-1989. Late migrants apparently used stored energy to reduce food intake, possibly to minimize mortality during winter. Early migrants apparently minimized exposure to hunting by feeding almost entirely within refuges during autumn. With smaller energy reserves, early migrants maintained higher levels of energy intake to maintain body condition after autumn, possibly increasing mortality risk during winter. We expected more similar trends in body condition between early and late migrant Canada geese, and more consistent losses of nutrient reserves each year if winter weight declines were driven by an endogenous physiological rhythm. We see no reason to invoke an endogenously driven physiological mechanism to explain winter weight losses in MVP Canada geese. Without controlled metabolic experiments, we prefer the simpler and more plausible explanation that winter weight declines result from facultative adjustments of feeding behavior to weather conditions, food availability, and pre-winter nutrient reserves. Overwinter survival should be enhanced by an energetic strategy that balances potential benefits and risks of feeding in relation to the size of remaining nutrient reserves. Decline of the early migrant tradition during the 1990's suggests that the energetic strategy of late migrants is more suited to recent harvest and refuge management regimes. Adults deposited 73\% (females) and 28\% (males) of their spring protein reserves while migrating between southern Illinois and east-central Wisconsin. Spring lipid reserves were acquired mostly (84\% in females, 92\% in males) during a 4-5 week staging period in east-central Wisconsin. Juveniles deposited 41-51\% of lipid reserves and 80-91\% of protein between southern Illinois and east-central Wisconsin. Feeding time (x = 5.8 hr/day), and food intake (x = 263 g/day) increased during spring-staging when lipid reserves more than doubled. Spring-staging geese consumed a moderate energy (x = 3.25 kcal/g) low protein (x = 13\%) diet that was more evenly composed of corn (x = 50\%), wild seeds and rootstocks (x = 21\%), and green forages (x = 27\%) compared to autumn and winter. Deposition of nutrient reserves was neither time- nor resource-limited during spring migration. Thus, food resources likely did not limit reproduction of MVP Canada geese under the conditions we observed during 1984-1989. Shallow wetland and moist soil habitats can be enhanced on southern Illinois refuges to benefit a wider diversity of wetland-dependent species and provide nutritional resources for geese without compromising energy available to support wintering populations. However, geese still need an abundant source of energy during autumn and winter, particularly when foraging opportunities are restricted by inclement weather or hunting. Food restriction on winter refuges during long and late-closing hunting seasons in the 1990's may have contributed to long-term changes in autumn migration patterns and wintering traditions in southern Illinois. Forage and non-crop foods are essential sources of protein and other nutrients during all seasons. but are especially important during spring migration. Shallow wetlands and lowland pastures on private lands in central Illinois and east-central Wisconsin are critical sources of non-crop foods that provide essential nutrients that geese use to complete the nesting cycle. Thus, reproduction could be impaired in the future if changing land use and farming practices reduce availability of moist soil and lowland pasture habitats.",164,1,"excluded","No green nest material"
"GNM_169","X.WOS.000080857100020","Nonadiabatic effects in the phonon spectra of superconductors","Karakozov, AE and Maksimov, EG","JOURNAL OF EXPERIMENTAL AND THEORETICAL PHYSICS","88","5","987-996",1999,"10.1134/1.558881","The nonadiabatic corrections to the self-energy part Sigma(s)(q,omega) of the phonon Green's function are studied for various values of the phonon vectors q resulting from electron-phonon interactions. It is shown that the long-range electron-electron Coulomb interaction has no direct influence on these effects, aside from a possible renormalization of the corresponding constants. The electronic response functions and Sigma(s)(q,omega) are calculated for arbitrary vectors q and energy omega in the BCS approximation. The results obtained for q = 0 agree with previously obtained results. It is shown that for large wave numbers q, vertex corrections are negligible and Sigma(s)(q,omega) possesses a logarithmic singularity at omega = 2 Delta, where Delta is the superconducting gap. It is also shown that in systems with nesting, Sigma(s)(Q,omega) (where Q is the nesting vector) possesses a square-root singularity at omega = 2 Delta, i.e., exactly of the same type as at q = 0. The results are used to explain the recently published experimental data on phonon anomalies, observed in nickel borocarbides in the superconducting state, at large q. It is shown, specifically, that in these systems nesting must be taken into account in order to account for the emergence of a narrow additional line in the phonon spectral function S(q,omega) approximate to -pi(-1)Im D-s(q,omega), where D-s(q,omega) is the phonon Green's function, at temperatures T < T-c. (C) 1999 American Institute of Physics. {[}S1063-7761(99)02005-3].",169,2,"excluded","Out of field"
"GNM_178","X.WOS.A1996UV70000011","Marking technique of embryo in egg for identification of small passerine (Passeriformes) nestlings after hatching","Lebedeva, NV","ZOOLOGICHESKY ZHURNAL","75","5","757-762",1996,NA,"A simple technique of marking embryos in eggs for identification of small passerine nestlings after hatching is described. The shell of pipping eggs of tree and house sparrow were perforated on the pipping opening and the embryo beaks were. marl;ed with a marker (0,5 mm). Holes in egg shells were no mole than 2 x 2 mm in size. Red, green, blue and black waterproof ink was used, The portion of the identified nestlings within the experimental broods amounted to 76\% (tree sparrows) and 91\% (house sparrows). Hatching mortality in control and in experimental clutches did not differ significantly.",178,2,"excluded","No green nest material"
"GNM_181","X.WOS.A1992HN89900014","BLUE EGGS DO NOT REDUCE NEST PREDATION IN THE SONG THRUSH, TURDUS-PHILOMELOS","GOTMARK, F","BEHAVIORAL ECOLOGY AND SOCIOBIOLOGY","30","3-4","245-252",1992,"10.1007/BF00166709","Many passerine birds with open cup-shaped nests lay blue or blue-green eggs. In thrushes, blue eggs may be cryptic and provide camouflage by imitating spots of light on green leaves. Alternatively, egg coloration may be selectively neutral because nest predators detect nests and not eggs, or it may be maladaptive because organisms are not always well adapted to their present environment. I evaluated these hypotheses by studying predation on artificial song thrush (Turdus philomelos) nests with quail eggs, painted either white, blue, or spotted (cryptic to a human eye). Corvids were the major nest predators. For concealed as well as exposed nests, I found no differences in the predation rates of nests with white, blue, or spotted eggs. Predators apparently detected the nests, and not the eggs, first. In a second experiment, I placed egg groups without nests in trees to study the effect of color per se. The predation rate of the spotted egg groups was significantly lower than that of the white and blue egg groups, for concealed as well as exposed egg groups. These results suggest that blue eggs in the song thrush are not cryptic but may be selectively neutral or even maladaptive with regard to nest predation.",181,1,"excluded","No green nest material"
"GNM_183","X.WOS.A1991GD12600005","GREAT-LAKES EMBRYO MORTALITY, EDEMA, AND DEFORMITIES SYNDROME (GLEMEDS) IN COLONIAL FISH-EATING BIRDS - SIMILARITY TO CHICK-EDEMA DISEASE","GILBERTSON, M and KUBIAK, T and LUDWIG, J and FOX, G","JOURNAL OF TOXICOLOGY AND ENVIRONMENTAL HEALTH","33","4","455-520",1991,"10.1080/15287399109531538","Several species of colonial fish-eating birds nesting in the Great Lakes basin, including herring gulls, common terns and double-crested cormorants, have exhibited chronic impairment of reproduction. In addition to eggshell thinning caused by high levels of DDT and metabolites, the reproductive impairment is characterized by high embryonic and chick mortality, edema, growth retardation, and deformities, hence the name Great Lakes embryo mortality, edema, and deformities syndrome (GLEMEDS). The hypothesis has been advanced that GLEMEDS in colonial fish-eating birds resembles chick-edema disease of poultry and has been caused by exposure to chick-edema active compounds that have a common mode of action through the cytochrome P-448 system. Detailed evidence has been collected from the following three groups of studies on herring gulls in the lower Great Lakes during the early 1970s; Forster's terns in Green Bay, Wisconsin in 1983; and double-crested cormorants and Caspian terns in various locations in the upper Great Lakes from 1986 onwards. It has proved difficult to establish not only the onset of the disease in the various species at various locations but also the period in which chick-edema active compounds were released. Anecdotal evidence suggested that serious egg mortality in Lake Ontario herring gulls first occurred in 1966, though the signs of chick-edema disease were not looked for until 1974. Only indirect evidence is available on the date of the release of one of the presumed causal agents, 2,3,7,8-tetrachlorodibenzo-p-dioxin, but highest levels may have occurred in the early to mid 1960s. More reliable data show that the onset of the improvement of reproduction of Lake Ontario herring gulls coincided with the declines in organochlorine compounds and particularly 2,3,7,8-TCDD and PCB. Similarly, information on the onset of the disease and exposures in the Forster's tern and double-crested cormorants in Green Bay is uncertain but bird banders did not observe deformities until the 1970s, which corresponds with the onset of high levels of PCB. If the disappearance of the Caspian tern from Saginaw Bay in the mid 1960s corresponds with the onset of GLEMEDS at that location, then there is a close temporal relationship to the onset of high PCB levels. Chick-edema disease is difficult to diagnose because there is no specific lesion, but rather there is a suite of lesions. GLEMEDS is characterized by an elevated incidence of embryonic and chick mortality, growth retardation, and developmental abnormalities, including bill deformities, club feet, missing eyes, and defective feathering, and there is also subcutaneous, percardial, and peritoneal edema, liver enlargement, liver necrosis, and porphyria. These signs conform to the known symptoms of chick-edema disease. A variety of chick-edema active compounds, including non-ortho-substituted PCBs and dibenzo-p-dioxins and furans substituted at the lateral positions, produce chick-edema disease. The active compounds have specific conformational requirements. In considering evidence on the strength of association, the embryos and chicks of herring gulls from Lake Ontario and Forster's terns from Green Bay had a significant increase in the incidence of the lesions compared to the reference colonies. Similarly, the incidence of bill abnormalities was significantly elevated in Great Lakes colonies of double-crested cormorants particularly for Green Bay, Wisconsin. There was a significant dose-response relationship between the incidence of embryonic mortality in cormorant eggs and the presence of chick-edema active compounds expressed in 2,3,7,8-TCDD equivalents. There is a high degree of consistency on replication. The disease has been found in a variety of species in a variety of locations, by different observers using different study designs. Outbreaks of the disease have occurred at different times and seem only to be related to exposures of developing embryos to high levels of chick-edema active compounds. The new facts, that embryos and chicks of colonial, fish-eating birds can exhibit signs resembling chick-edema disease when exposed to chick-edema active compounds, cohere with existing biological theory, experience, and experimentation. There are plausible routes of exposure and sources of these compounds to the Great Lakes, and statistically significant dose-response relationships have been demonstrated.",183,1,"excluded","duplicate"
"GNM_185","Scott.Baumann20221186","Effects of nest-box environment on fledgling success rate and pathogen load","Scott-Baumann, J.F. and Morgan, E.R. and Cogan, T.A.","Parasitology","149","9","1186-1192",2022,"10.1017/S0031182022000695","Nest boxes have been used for many decades as tools for conservation and to study avian population dynamics. Plastic is increasingly used as a material for nest boxes, but no studies have investigated effects of this different material. Two consecutive studies were conducted to investigate effects of nest-box environment on nidicolous parasites, bacteria and fungi, as well as nest success, in blue tits Cyanistes caeruleus and great tits Parus major. The first compared microclimate and parasite and pathogen load in plastic and wooden nest boxes. The second tested the nest protection hypothesis-that birds naturally incorporate aromatic herbs into nests to decrease nest parasites and pathogens-by comparing parasite and pathogen load in plastic nest boxes to which aromatic or non-aromatic plant material was added. No significant difference in nest-box temperature or relative humidity was found between plastic and wooden boxes. Wooden boxes, however, contained 30-fold higher numbers of fleas and a higher total bacterial load on chicks. Fledging success for blue tit broods was significantly higher in wooden boxes. Parasites and bacteria did not decrease by the inclusion of aromatic herbs. The results increase the evidence base for nest-box design in support of plastic, which can provide an appropriate alternative nest-box material to wood, with apparently no difference in microclimate and no increase in the load of measured parasites and pathogens. Copyright √Ç¬© The Author(s), 2022. Published by Cambridge University Press.",185,1,"selected",NA
