"paper_id","label","title","author","journal","volume","number","pages","year","doi","abstract","search_duplicated","n_duplicates","screened_final","notes_final"
"GNM_099","Fayle20121279","Public goods, public services and by-product mutualism in an ant-fern symbiosis","Fayle, T.M. and Edwards, D.P. and Turner, E.C. and Dumbrell, A.J. and Eggleton, P. and Foster, W.A.","Oikos","121","8","1279-1286",2012,"10.1111/j.1600-0706.2011.20062.x","Mutualism can evolve when organisms make novel connections that happen to benefit all parties. When such connections involve a host that provides a public good for multiple visitor species, selection for reciprocal cooperation is only likely if the host has the power to preferentially increase the fitness of those visitors that provide a better quality service. In contrast, when interactions form between multiple visitors and a host that lacks the power to partition the public good, we predict that interactions are likely to persist only as by-product mutualisms, in which symbiosis benefits both host and visitor, but in which neither partner makes costly investments. Focusing on the symbiosis between ants and litter trapping epiphytes in the canopy of lowland dipterocarp rain forest in Borneo, we show that at least 71 ant species share the public good of housing within the root-mass of epiphytic bird's nest ferns (Asplenium spp.). Ferns supporting a higher biomass of ants experienced less herbivory, and experimental exclusions of ants from fronds confirmed that this is caused by the ants protecting the ferns from herbivores. These results establish that there are clear by-product benefits for both parties of housing for ants and protection for ferns. If these benefits were to drive selection for reciprocal cooperation, we would expect larger ferns to support ant colonies that were larger or colonies that produce more reproductive individuals. This was not the case. Larger ferns instead supported more ant colonies, indicating that the housing provided by the fern is a public good that is not restricted to better cooperating ant species. Mutualism via novel connections is thus unlikely to evolve between a host and multiple partners, even if there are clear by-product benefits to all parties, unless the host can direct benefits to cooperators. √Ç¬© 2011 The Authors. Oikos √Ç¬© 2011 Nordic Society Oikos.",99,2,"excluded","Not birds"
"GNM_104","Martin2012195","Climate impacts on bird and plant communities from altered animal-plant interactions","Martin, T.E. and Maron, J.L.","Nature Climate Change","2","3","195-200",2012,"10.1038/nclimate1348","The contribution of climate change to declining populations of organisms remains a question of outstanding concern. Much attention to declining populations has focused on how changing climate drives phenological mismatches between animals and their food. Effects of climate on plant communities may provide an alternative, but particularly powerful, influence on animal populations because plants provide their habitats. Here, we show that abundances of deciduous trees and associated songbirds have declined with decreasing snowfall over 22 years of study in montane Arizona, USA. We experimentally tested the hypothesis that declining snowfall indirectly influences plants and associated birds by allowing greater over-winter herbivory by elk (Cervus canadensis). We excluded elk from one of two paired snowmelt drainages (10√ÑÔøΩ√¢‚Ç¨¬∞ ha per drainage), and replicated this paired experiment across three distant canyons. Over six years, we reversed multi-decade declines in plant and bird populations by experimentally inhibiting heavy winter herbivory associated with declining snowfall. Moreover, predation rates on songbird nests decreased in exclosures, despite higher abundances of nest predators, demonstrating the over-riding importance of habitat quality to avian recruitment. Thus, our results suggest that climate impacts on plant-animal interactions can have forceful ramifying effects on plants, birds, and ecological interactions. √Ç¬© 2012 Macmillan Publishers Limited. All rights reserved.",104,2,"excluded","Not experimental"
"GNM_108","Avil.U.00C3..U.00A9.s20111721","Sexual selection based on egg colour: Physiological models and egg discrimination experiments in a cavity-nesting bird","Avil√É¬©s, J.M. and Soler, J.J. and Hart, N.S.","Behavioral Ecology and Sociobiology","65","9","1721-1730",2011,"10.1007/s00265-011-1180-8","It has been proposed that the blue-green bird egg colourations of many avian species may constitute a sexually selected female signal that males can use to modulate their parental investment. A fundamental untested assumption for the validation of this hypothesis is that males can accurately assess differences in the colour of eggs. A recent review suggests that this could be particularly problematic when egg clutches were located within a dimly lit nest cavity, due to limitations of the visual system in low light conditions. Here, we first used a photoreceptor noise-limited model of colour discrimination ability that accounts for visual performance under low light conditions to study whether a typical cavity-nesting passerine, the spotless starling Sturnus unicolor, can discriminate their eggs under the ambient illumination in their nest-holes. Secondly, we tested the validity of model predictions with behavioural data collected in two egg discrimination experiments performed in this species. Estimated egg detectability depended entirely on model assumptions about visual limitations linked to light intensity. Starlings would not be able to discriminate egg differences in their nests if the model was based on the assumption that light intensity limited detectability, whereas they could potentially perceive as different many possible pairwise clutch comparisons if the model assumption was that light intensity did not limit detectability. Results of behavioural experiments fitted the prediction of the visual model where light intensity did not limit detectability. Our results suggest that photoreceptor noise-limited colour models based on stimulation of single photoreceptors cannot, at present, be used to predict egg discrimination ability in spotless starlings under low light conditions. Future studies aiming to test egg discrimination constraints in the frame of the sexual selection hypothesis should therefore combine both modelling and behavioural experiments to determine which are the components of the models that produce the mismatch with the behavioural conditions. √Ç¬© 2011 Springer-Verlag.",108,2,"excluded","No green nest material"
"GNM_109","X.WOS.000292960400004","The role of adult experience in nest building in the zebra finch, Taeniopygia guttata","Muth, Felicity and Healy, Susan D.","ANIMAL BEHAVIOUR","82","2","185-189",2011,"10.1016/j.anbehav.2011.04.021","Whether learning plays a role in nest building in birds is largely unknown. Here we investigated whether the colour of nest materials used to build a first nest affected the subsequent nest material choices made by male zebra finches when building a second nest. Males were tested for their preference for green or brown nest material and then were provided with either their preferred or nonpreferred colour with which to build their first nest. The success of this nesting attempt was manipulated such that half of the breeding pairs had their eggs removed, while the other half were allowed to keep their eggs and fledge chicks. Males were then retested to determine which colour of nest material they now preferred. Males had strong initial preferences for one or other of the two colours of nest material. Males that built a nest with their preferred colour of nest material continued to prefer that colour after nesting, regardless of their breeding success in that nest. However, of the males that built a nest with material of their nonpreferred colour, those that raised and fledged chicks from it subsequently preferred that colour of material for their second nest, while males that suffered a failed breeding attempt did not. Thus breeding experience can influence decisions relating to nest material choice in nest construction in the zebra finch. (C) 2011 The Association for the Study of Animal Behaviour. Published by Elsevier Ltd. All rights reserved.",109,2,"excluded","No green nest material"
"GNM_112","Veiga20111359","Feathers in the spotless starling nests: A sexually selected trait?","Veiga, J.P. and Polo, V.","Behaviour","148","Nov 13","1359-1375",2011,"10.1163/000579511X608684","The carrying of feathers to adorn the nest has been recently described as a female behaviour that indicates quality in a passerine bird-the spotless starling (Sturnus unicolor)-, but the consequences that the variability of this trait may have on breeding success are still unknown. The feather-carrying behaviour is a sexual behaviour that is performed in response to a male display: the carrying of green plants. In this paper we explore whether foreign feathers affect male investment on chick rearing or reinforce the pair mating bonds. The experimental addition of feathers to nests caused an increase in clutch size and a reduction of nestling mortality, although it did not affect feeding rates or the removal of faecal sacs by males or females. Nest feathers did not increase the frequency with which females laid a second clutch in the same nest and with the same male. Thus, our results do not support the sexual selection hypothesis for the evolution of the carrying feathers behaviour. An alternative hypothesis that deserves to be addressed in specifically designed studies is that foreign feathers may be taken to nests as a sort of chemical warfare against nest parasites. The sexual selection and the chemical defence hypotheses are, however, not mutually exclusive and future research should evaluate whether the pre-existence of a behavioural trait arising by natural selection may drive the evolution of a signalling trait. √Ç¬© 2011 Koninklijke Brill NV, Leiden.",112,2,"excluded","No green nest material"
"GNM_114","X.WOS.000282111400009","RESPONSE OF BIRDS IN TROPICAL DECIDUOUS FOREST TO BROWN-HEADED COWBIRDS (MOLOTHRUS ATER)","Mendoza-Rodriguez, Victor H. and Vega Rivera, Jorge H. and Medina-Montano, Irais and Campos-Cerda, Felipe","SOUTHWESTERN NATURALIST","55","3","390-393",2010,"10.1894/MH-46.1","During June September 2007, we searched bird nests for evidence of parasitism by brown-headed cowbirds (Molothrus ater) and we tested response of the avian community to taxidermy mounts of a brown-headed cowbird in a tropical deciduous forest in the Chamela-Cuixmala Biosphere Reserve in western Mexico. Of 46 nests found (black-capped gnatcatcher Polioptila nigriceps, 2; red-breasted chat Granatellus venustus, 1; blue bunting Cyanocompsa parellina, 1; orange-breasted bunting Passerine leclancherii, 1; rufous-backed thrush Turdus rulopalliatus, 1; yellow-green vireo Vireo flavoviridis, 39), only one was parasitized (nest of a black-capped gnatcatcher). Experimental responses to taxidermy mounts suggested that yellow-green vireos may have had previous contact with cowbirds. We conclude that in the Chamela-Cuixmala Biosphere Reserve, parasitism by brown-headed and bronzed cowbirds (Molothrus aeneus) remains low, or even absent for some species, as on the yellow-green vireo, but this situation could change in the near future because significant developments for the tourism industry are planned adjacent to the reserve; that could create new habitat and sources of food for cowbirds.",114,1,"excluded","No green nest material"
"GNM_127","Masello2008653","Is the structural and psittacofulvin-based coloration of wild burrowing parrots Cyanoliseus patagonus condition dependent?","Masello, J.F. and Lubjuhn, T. and Quillfeldt, P.","Journal of Avian Biology","39","6","653-662",2008,"10.1111/j.1600-048X.2008.04417.x","The bright colours of parrots are caused by psittacofulvin pigments, which appear unique to this Order, and by structural colours. We measured red (psittacofulvin), green (mixed) and blue (structural) colours of wild burrowing parrots Cyanoliseus patagonus of northeastern Patagonia, Argentina, and measured nestlings regularly to obtain data on breeding success and nestling growth. As adult feathers are moulted outside the breeding season, adult body condition could not be measured directly during feather growth, and climatic conditions were used as an indirect parameter. The colony of burrowing parrots is surrounded by Monte steppe habitat, the breeding success has been shown to depend strongly on the climatic patterns. The area experienced a drought with very poor breeding success as well as a year of above-average precipitation during the study period, serving as a natural experiment. We thus analysed the variability of colouration within the population among and within breeding seasons. We observed strong inter-annual differences in nestling and adult colouration. Nestlings grew blue feathers with lower achromatic brightness during better conditions, and when controlling for year effects, nestlings with higher mass and from more successful families also had blue feathers with lower achromatic brightness. Adult blue feathers showed the same trend, with lower achromatic brightness in the moult following breeding seasons of better conditions. In contrast, during better conditions, adults grew red feathers with higher achromatic brightness and the colour hue was also affected, and the hue of the red region of nestlings varied with the hatching order. The colour of all three regions of nestlings varied between nests, and the colour of the red region of adult males positively correlated with breeding success (clutch size, brood size). In summary, the present data suggest that environmental conditions contribute to variability in both structural and the psittacofulvin-based colours of wild burrowing parrots. √Ç¬© 2008 The Authors.",127,2,"excluded","Not experimental"
"GNM_130","Soler2008183","Sexually selected egg coloration in spotless starlings","Soler, J.J. and Navarro, C. and Contreras, T.P. and Avil√É¬©s, J.M. and Cuervo, J.J.","American Naturalist","171","2","183-194",2008,"10.1086/524958","It has been recently proposed that the blue-green coloration in eggs of many avian species may constitute a sexually selected female signal. Blue-green color intensity would reflect the physiological condition of females, and hence it might also affect the allocation of male parental care. In this study, we use three different experimental approaches to explore the importance of sexual selection on blue-green egg coloration of spotless starling (Sturnus unicolor) eggs. First, experimental deterioration of female body condition (by means of wing feather removal) negatively affected the intensity of blue-green egg coloration. Second, blue-green color intensity of artificial model eggs had a significant positive influence on paternal feeding effort. Finally, we found a negative relationship between the effect of experimental food supply on nestling immunocompetence and the intensity of blue-green coloration of eggs, suggesting that egg color predicts nutritional conditions that nestlings will experience during development. All these results taken together strongly support a role of sexual selection in the blue-green coloration of spotless starling eggs. √Ç¬© 2007 by The University of Chicago. All rights reserved.",130,2,"excluded","No green nest material"
"GNM_135","Gentes2007167","Tree swallows (Tachycineta bicolor) nesting on wetlands impacted by oil sands mining are highly parasitized by the bird blow fly Protocalliphora spp","Gentes, M.-L. and Whitworth, T.L. and Waldner, C. and Fenton, H. and Smits, J.E.","Journal of Wildlife Diseases","43","2","167-178",2007,"10.7589/0090-3558-43.2.167","Oil sands mining is steadily expanding in Alberta, Canada. Major companies are planning reclamation strategies for mine tailings, in which wetlands will be used for the bioremediation of water and sediments contaminated with polycyclic aromatic hydrocarbons and naphthenic acids during the extraction process. A series of experimental wetlands were built on companies' leases to assess the feasibility of this approach, and tree swallows (Tachycineta bicolor) were designated as upper trophic biological sentinels. From May to July 2004, prevalence and intensity of infestation with bird blow flies Protocalliphora spp. (Diptera: Calliphoridae) were measured in nests on oil sands reclaimed wetlands and compared with those on a reference site. Nestling growth and survival also were monitored. Prevalence of infestation was surprisingly high for a small cavity nester; 100% of the 38 nests examined were infested. Nests on wetlands containing oil sands waste materials harbored on average from 60% to 72% more blow fly larvae than those on the reference site. Nestlings on reclaimed sites suffered mean parasitic burdens about twice that of those on the reference site; and for comparable parasitic load, they exhibited greater pathologic effects (e.g., decreased body mass) than control nestlings. The heavy blow fly infestation on oil sands-impacted wetlands suggests that oil sands mining disturbs several components of the local, ecosystem, including habitat characteristics, blow fly predators, and host resistance to parasites. √Ç¬© Wildlife Disease Association 2007.",135,2,"excluded","Not experimental"
"GNM_146","X.WOS.000222125700012","Against the odds? Nestling sex ratio variation in green-rumped parrotlets","Budden, AE and Beissinger, SR","BEHAVIORAL ECOLOGY","15","4","607-613",2004,"10.1093/beheco/arh052","We investigated nestling sex ratio variation in the green-rumped parrotlet (Forpus passerinus), a small neotropical parrot breeding in central Venezuela. There are strong theoretical reasons to predict a female-biased sex ratio in this system according to the local resource hypothesis; juvenile males are philopatric and there are high levels of competition between male siblings for access to breeding females. Data were collected from two breeding sites over a 14-year period incorporating 564 broods with a total of 2728 nestlings. The mean percentage of male nestlings across years was 51\%. Despite extreme hatching asynchrony in this system and increased survival of earlier hatched offspring, there was no bias in sex allocation associated with egg sequence. Patterns in sex allocation were not associated with clutch size, age, or size of the breeding female or breeding site. The potential for selective resorption of eggs was considered; however, no significant relationship was found between extended laying intervals and the sex of subsequent eggs. Together, these results suggest that female parrotlets are unable to regulate the sex ratio of their clutch at laying or that facultative manipulation of nestling sex ratio may not confer a fitness benefit to breeders in these populations.",146,2,"excluded","Not experimental"
"GNM_148","X.WOS.000223085900003","Egg colouration and male parental effort in the pied flycatcher Ficedula hypoleuca","Moreno, J and Osorno, JL and Morales, J and Merino, S and Tomas, G","JOURNAL OF AVIAN BIOLOGY","35","4","300-304",2004,"10.1111/j.0908-8857.2004.03407.x","A recent hypothesis posits that the bright colours of many avian eggs may act like signals of female genetic quality or condition to males in species with biparental care, inducing them to work harder for their offspring. We measured the colour of blue eggs of pied flycatchers Ficedula hypoleuca in Central Spain with a spectrophotometer on the day of laying, and also quantified the provisioning effort by males and females during the last days of the nestling period. Both chromaticity coordinates in the CIELAB colour space (blue to yellow, green to red) showed significant associations with male provisioning rates, explaining more than 20\% of variation in male parental effort. Male provisioning rates were positively correlated with nestling condition, thereby potentially contributing to female fitness. This evidence is only tentative until experimental confirmation, but suggests that males are affected by the colour of their mates' eggs, a possibility not considered hitherto in the study of sexual selection.",148,2,"excluded","Not experimental"
"GNM_151","Passos2004376","Interaction between ants and fruits of Guapira opposita (Nyctaginaceae) in a Brazilian sandy plain rainforest: Ant effects on seeds and seedlings","Passos, L. and Oliveira, P.S.","Oecologia","139","3","376-382",2004,"10.1007/s00442-004-1531-5","This study examines the dispersal system of Guapira opposita in a tropical sandy rainforest in southeast Brazil. Guapira trees produce small fruits with a high protein content (28.4%) and low lipid content (0.3%), and the plant is primarily dispersed by birds. Mature fruits of G. opposita can fall spontaneously with the pulp intact, or be dropped by birds with bits of pulp attached. In either case, ground-dwelling ants rapidly remove the fruits to their nest (93% after 12 h). The ponerine ants Odontomachus chelifer and Pachycondyla striata are the main seed vectors among the ants, and together account for 56% (20 of 36) of the ant-fruit interactions recorded on the forest floor. Individual workers of O. chelifer and P. striata transport single fruits to their nests. Bits of pulp are fed to larvae and worker nestmates, and intact seeds are discarded outside the nest. Germination success in Guapira is higher for cleaned seeds (pulp removed) than for seeds coated by pulp. Guapira seedlings and juveniles are more frequent close to Odontomachus nests than at sites without such nests. Soil samples from Odontomachus nests had greater penetrability, and higher concentrations of P, K, and Ca than random soil samples. Field experiments suggest that the association between G. opposita seedlings and O. chelifer nests can potentially render the plant some protection against herbivores. Results indicate that fruit displacement by ponerine ants play an important role in the biology of G. opposita seeds and seedlings in the sandy forest, and illustrate the complex nature of the dispersal ecology of tropical tree species. √Ç¬© Springer-Verlag 2004.",151,2,"excluded","Not birds"
"GNM_154","Stavropoulos2003905","In vitro study of guide wire entrapment in currently available inferior vena cava filters","Stavropoulos, S.W. and Itkin, M. and Trerotola, S.O.","Journal of Vascular and Interventional Radiology","14","7","905-910",2003,"10.1097/01.RVI.0000082827.75926.10","PURPOSE: Guide wire entrapment by some older inferior vena cava (IVC) filters is known to occur, particularly with J-tipped wires. Three new IVC filters have recently been approved for use in the United States. An in vitro study was performed to compare the risk of engaging and entrapping guide wires in eight of the IVC filters currently available in the United States. MATERIALS AND METHODS: Titanium Greenfield, over-the-wire stainless-steel Greenfield, Simon nitinol, Bird's Nest, Vena Tech LGM, Vena Tech LP, TrapEase, and G√É¬ºnther Tulip IVC filters were deployed separately in an in vitro IVC flow model. Four different wires (15-mm, 3-mm, and 1.5-mm J-tipped, and straight) were passed 100 times each through the filters (50 from a jugular approach and 50 from a femoral approach). The frequency and specific patterns of engagement of the wires by the filters were recorded. Engagement was defined as a filter/wire interaction that caused either the filter or the wire to be deformed. The second part of the experiment measured the force (in pounds) that was required to release wires that became engaged in the filters with use of an electromechanical test stand with a specially designed low-capacity load cell of 20 pounds. Entrapment was defined as inability to separate an engaged wire from the filter without damage to either the wire or filter. RESULTS: Guide wire engagement occurred in all filters tested with the 15-mm, 3-mm, and 1.5-mm J-tipped wires. The straight wire did not engage any of the filters. The wires engaged the TrapEase filter with the greatest frequency overall (72.8%; 291 of 400). The 15-mm J wire engaged the filters more often than the other wires (98.5%; 788 of 800), but never became entrapped in a filter. The Vena Tech LP and G√É¬ºnther Tulip filters did not entrap any of the wires. The TrapEase filter, the stainless-steel Greenfield filter, and the Vena Tech LGM filter entrapped the 3-mm and 1.5-mm J wires. The force required to disengage the wires from these filters exceeded 4 pounds and resulted in structural damage to the wire and/or filter. CONCLUSIONS: Among the IVC filters recently approved by the Food and Drug Administration, the TrapEase filter entrapped 3-mm and 1.5-mm J-tipped guide wires, whereas the Vena Tech LP and G√É¬ºnther Tulip filters did not. This study corroborates previously described wire entrapment by the stainless-steel Greenfield and Vena Tech LGM devices.",154,2,"excluded","Out of field"
